{
  "$schema": "https://json-schema.org/draft/2020-12/schema",
  "$id": "urn:proyecto4:contracts:edge-capture-event",
  "title": "Edge Capture Event",
  "description": "Metadata que el dispositivo edge envía en la parte JSON del POST /api/edge-captures (multipart/form-data). Describe la captura y la predicción calculada localmente. NO incluye received_at ni image_key: esos campos los asigna el backend al persistir en AWS y solo aparecen en la respuesta. Este schema es el contrato de P4-0.1 y debe congelarse antes de implementar edge, AWS y frontend.",
  "type": "object",
  "additionalProperties": false,
  "required": [
    "capture_id",
    "captured_at",
    "device_id",
    "model_version",
    "predicted_class",
    "confidence",
    "image_sha256"
  ],
  "properties": {
    "capture_id": {
      "type": "string",
      "format": "uuid",
      "pattern": "^[0-9a-fA-F]{8}-[0-9a-fA-F]{4}-[0-9a-fA-F]{4}-[0-9a-fA-F]{4}-[0-9a-fA-F]{12}$",
      "description": "UUID generado en el edge. Permanece idéntico en cada reintento del mismo evento (clave de idempotencia). El `pattern` repite la regla de `format: uuid` para que se cumpla aunque el validador no evalúe `format`."
    },
    "captured_at": {
      "type": "string",
      "format": "date-time",
      "pattern": "^\\d{4}-\\d{2}-\\d{2}[Tt]\\d{2}:\\d{2}:\\d{2}(\\.\\d+)?([Zz]|[+-]\\d{2}:\\d{2})$",
      "description": "Fecha y hora de la captura en el dispositivo, en RFC 3339 con zona horaria explícita ('Z' o desplazamiento +hh:mm / -hh:mm). No se aceptan fechas ingenuas sin zona horaria."
    },
    "device_id": {
      "type": "string",
      "minLength": 1,
      "maxLength": 128,
      "pattern": "\\S",
      "description": "Identificador estable y configurable del dispositivo. No vacío ni compuesto solo por espacios."
    },
    "model_version": {
      "type": "string",
      "minLength": 1,
      "maxLength": 256,
      "pattern": "\\S",
      "description": "Versión y hash de la variante optimizada en ejecución (por ejemplo 'onnx-int8-1.0.0+sha256:9f2c...'). No vacío ni compuesto solo por espacios."
    },
    "predicted_class": {
      "type": "string",
      "enum": ["car", "person"],
      "description": "Una de las dos clases congeladas del Proyecto 3. No se permiten clases nuevas."
    },
    "confidence": {
      "type": "number",
      "minimum": 0,
      "maximum": 1,
      "description": "Confianza de la predicción calculada localmente, en el rango inclusivo [0, 1]."
    },
    "image_sha256": {
      "type": "string",
      "pattern": "^[0-9a-f]{64}$",
      "description": "SHA-256 de los mismos bytes de imagen enviados en el multipart, en hexadecimal minúsculas (exactamente 64 caracteres)."
    },
    "crop": {
      "type": "object",
      "additionalProperties": false,
      "required": ["x", "y", "width", "height"],
      "description": "Región de recorte aplicada antes de clasificar, en píxeles de la imagen enviada. Opcional: se omite cuando no se aplica recorte.",
      "properties": {
        "x": {
          "type": "integer",
          "minimum": 0,
          "description": "Coordenada X del origen del recorte, en píxeles (>= 0)."
        },
        "y": {
          "type": "integer",
          "minimum": 0,
          "description": "Coordenada Y del origen del recorte, en píxeles (>= 0)."
        },
        "width": {
          "type": "integer",
          "minimum": 1,
          "description": "Ancho del recorte, en píxeles (> 0)."
        },
        "height": {
          "type": "integer",
          "minimum": 1,
          "description": "Alto del recorte, en píxeles (> 0)."
        }
      }
    }
  }
}
